{
  "schemaVersion": "labcentral.proxmox-qualification-probe-response/v1",
  "runID": "qualification.probe-001",
  "nonce": "aaaaaaaaaaaaaaaaaaaaaaaaaaaaaaaaaaaaaaaaaaaaaaaaaaaaaaaaaaaaaaaa",
  "agentImageDigest": "sha256:aaaaaaaaaaaaaaaaaaaaaaaaaaaaaaaaaaaaaaaaaaaaaaaaaaaaaaaaaaaaaaaa",
  "startedAt": "2026-09-02T20:30:00Z",
  "completedAt": "2026-09-02T20:30:01Z",
  "results": [
    {"kind": "intended_segment", "endpointDigest": "sha256:bbbbbbbbbbbbbbbbbbbbbbbbbbbbbbbbbbbbbbbbbbbbbbbbbbbbbbbbbbbbbbbb", "attempts": 3, "successes": 3},
    {"kind": "management", "endpointDigest": "sha256:cccccccccccccccccccccccccccccccccccccccccccccccccccccccccccccccc", "attempts": 3, "successes": 0},
    {"kind": "cross_instance", "endpointDigest": "sha256:dddddddddddddddddddddddddddddddddddddddddddddddddddddddddddddddd", "attempts": 3, "successes": 0}
  ]
}
